{
  "$schema": "https://json-schema.org/draft/2020-12/schema",
  "$id": "https://local.morning-signal/snapshot-v1.schema.json",
  "title": "每日资讯博弈每日快照 V1",
  "type": "object",
  "required": ["schema_version", "indicator_version", "model_version", "report_date", "as_of", "timezone", "data_state", "metrics", "opportunities", "risks", "events", "data_gaps", "run"],
  "properties": {
    "schema_version": { "const": "snapshot-v1.0.0" },
    "indicator_version": { "type": "string" },
    "model_version": { "type": "string" },
    "report_date": { "type": "string", "format": "date" },
    "as_of": { "type": "string", "format": "date-time" },
    "timezone": { "const": "Asia/Shanghai" },
    "data_state": { "enum": ["demo", "partial", "verified"] },
    "metrics": {
      "type": "array",
      "items": {
        "type": "object",
        "required": ["indicator_id", "indicator_name", "module", "frequency", "value", "unit", "period", "previous_value", "previous_period", "yoy_value", "yoy_period", "published_at", "available_at", "retrieved_at", "source_tier", "publisher", "canonical_url", "field_name", "confidence", "coverage", "freshness", "interpretation_type", "interpretation", "transform_formula", "revision_id"],
        "properties": {
          "indicator_id": { "type": "string", "pattern": "^M[1-7]-" },
          "indicator_name": { "type": "string", "minLength": 1 },
          "module": { "type": "string" },
          "frequency": { "enum": ["daily", "weekly", "monthly", "quarterly", "event"] },
          "value": { "type": ["number", "string", "null"] },
          "unit": { "type": ["string", "null"] },
          "period": { "type": "string" },
          "previous_value": { "type": ["number", "string", "null"] },
          "previous_period": { "type": ["string", "null"] },
          "yoy_value": { "type": ["number", "string", "null"] },
          "yoy_period": { "type": ["string", "null"] },
          "published_at": { "type": ["string", "null"], "format": "date-time" },
          "available_at": { "type": ["string", "null"], "format": "date-time" },
          "retrieved_at": { "type": "string", "format": "date-time" },
          "source_tier": { "enum": ["E0", "E1", "E2", "E3"] },
          "publisher": { "type": "string" },
          "canonical_url": { "type": "string" },
          "field_name": { "type": "string" },
          "confidence": { "type": "number", "minimum": 0, "maximum": 1 },
          "coverage": { "type": "number", "minimum": 0, "maximum": 1 },
          "freshness": { "type": "number", "minimum": 0, "maximum": 1 },
          "interpretation_type": { "enum": ["none", "opportunity", "risk", "watch"] },
          "interpretation": { "type": ["string", "null"] },
          "transform_formula": { "type": ["string", "null"] },
          "revision_id": { "type": "string" }
        },
        "additionalProperties": true
      }
    },
    "opportunities": { "type": "array", "maxItems": 3 },
    "sector_candidates": {
      "type": "array",
      "maxItems": 3,
      "items": {
        "type": "object",
        "required": ["rank", "industry_name", "opportunity_type", "adjusted_score", "status", "market_data_date", "evidence", "confirmation_conditions", "invalidation_conditions", "caveat"],
        "properties": {
          "rank": { "type": "integer", "minimum": 1, "maximum": 3 },
          "industry_name": { "type": "string", "minLength": 1 },
          "opportunity_type": { "enum": ["强势延续观察", "超跌修复观察"] },
          "adjusted_score": { "type": "number" },
          "status": { "const": "待确认" },
          "market_data_date": { "type": "string", "format": "date" },
          "evidence": { "type": "array", "minItems": 1, "items": { "type": "string" } },
          "confirmation_conditions": { "type": "string" },
          "invalidation_conditions": { "type": "string" },
          "caveat": { "type": "string" }
        },
        "additionalProperties": false
      }
    },
    "risks": { "type": "array" },
    "events": { "type": "array" },
    "major_news": {
      "type": "array",
      "maxItems": 9,
      "items": {
        "type": "object",
        "required": ["category", "headline", "published_at", "time_basis", "source_name", "source_url", "source_type", "impact_level", "tone", "affected_assets", "market_impact", "retrieved_at"]
      }
    },
    "shipping": {
      "type": "array",
      "maxItems": 3,
      "items": {
        "type": "object",
        "required": ["route_id", "route_name", "period", "vessel_count", "tanker_count", "average_7d", "average_28d", "change_vs_28d_pct", "publisher", "canonical_url", "retrieved_at"]
      }
    },
    "commodities": {
      "type": "array",
      "items": {
        "type": "object",
        "required": ["group", "symbol", "name", "contract", "price", "unit", "daily_change_pct", "weekly_change_pct", "period", "signal", "publisher", "canonical_url", "retrieved_at"]
      }
    },
    "data_gaps": { "type": "array" },
    "run": { "type": "object" }
  },
  "additionalProperties": false
}
